{
  "artifacts": {
    "per_query": {
      "path": "/home/sikmindz/Coding/agent-memory-kits/docs/benchmarks/beir-scifact-ranking/final-modes/all-hybrid-per-query.jsonl",
      "rows": 300,
      "sha256": "sha256:d409871979a836a57befdb62b491976c13e6024c87fc9918eacc3ab64ce3a46b"
    }
  },
  "claim_boundary": "ordinary retrieval ranking only; no competitor comparison or superiority claim",
  "config": {
    "cutoffs": [
      1,
      5,
      10
    ],
    "doc_id_marker": "[beir-scifact-doc-id:<corpus-id>]",
    "metric_averaging": "macro over official qrel queries",
    "query_split": "all",
    "relevance": "positive official qrels",
    "retrieval_mode": "hybrid",
    "top_k": 10
  },
  "dataset": {
    "archive": {
      "path": "/home/sikmindz/Coding/agent-memory-kits/.bench-data/beir-scifact-ranking/data/scifact.zip",
      "sha256": "sha256:536e14446a0ba56ed1398ab1055f39fe852686ecad24a6306c80c490fa8e0165"
    },
    "corpus": {
      "path": "/home/sikmindz/Coding/agent-memory-kits/.bench-data/beir-scifact-ranking/data/scifact/corpus.jsonl",
      "sha256": "sha256:dec31c8182f3d744c7d2c09423756fd1d17cbef75808db13ba01cc0aab4d1ac6"
    },
    "corpus_doc_count": 5183,
    "name": "BEIR Scifact official corpus/test qrels",
    "official_full_corpus_doc_count": 5183,
    "qrels": {
      "path": "/home/sikmindz/Coding/agent-memory-kits/.bench-data/beir-scifact-ranking/data/scifact/qrels/test.tsv",
      "qrels_count": 339,
      "query_count": 300,
      "sha256": "sha256:0864bb985e0ca2367ba217977e72004d549054b2b06666ed9d4825ac7c21284c"
    },
    "queries": {
      "path": "/home/sikmindz/Coding/agent-memory-kits/.bench-data/beir-scifact-ranking/data/scifact/queries.jsonl",
      "sha256": "sha256:8ff84a7c903f722981cd8d595c022660140c51867b27608a6d4910db86080313"
    },
    "selected_test_queries": 300,
    "source_url": "https://public.ukp.informatik.tu-darmstadt.de/thakur/BEIR/datasets/scifact.zip"
  },
  "embedding": {
    "backend": "ollama",
    "dimensions": 384,
    "max_document_chars": 700,
    "model": "all-minilm:latest",
    "probe": {
      "dimensions": 384,
      "latency_ms": 29.790712999783864,
      "model": "all-minilm:latest",
      "status": "passed"
    }
  },
  "execution": {
    "active_receipt_pass_elapsed_seconds": 18.973056925000492,
    "command": "python3 shared/scripts/benchmark-beir-scifact-ranking.py --work-dir .bench-data/beir-scifact-ranking --output-dir docs/benchmarks/beir-scifact-ranking/final-modes --model all-minilm:latest --dimensions 384 --max-chars 700 --mode hybrid --query-split all",
    "launcher": "/home/sikmindz/Coding/agent-memory-kits/shared/scripts/run-server.sh",
    "launcher_command": [
      "/home/sikmindz/Coding/agent-memory-kits/shared/scripts/run-server.sh",
      "--embedding-url",
      "http://127.0.0.1:11434",
      "--embedding-model",
      "all-minilm:latest",
      "--embedding-dims",
      "384"
    ],
    "launcher_sha256": "sha256:1a12aee8665d7da330ca2048be0f2dc16e3c512bcee55c9fb865f2565e533d2e",
    "namespace": "benchmark-beir-scifact-test-v1",
    "production_tools": {
      "available": [
        "sm_add_evidence",
        "sm_add_fact",
        "sm_add_graph_edge",
        "sm_community",
        "sm_consolidate_facts",
        "sm_create_claim",
        "sm_decide_action_authority",
        "sm_decide_assertion_authority",
        "sm_decoder_analyze",
        "sm_delete_fact",
        "sm_delete_namespace",
        "sm_detect_contradictions",
        "sm_discord_search",
        "sm_embeddings_are_dirty",
        "sm_factor_graph",
        "sm_get_fact",
        "sm_get_fact_neighbors",
        "sm_get_messages",
        "sm_get_search_receipt",
        "sm_graph_path",
        "sm_import_envelope",
        "sm_import_status",
        "sm_ingest_document",
        "sm_invalidate_graph_edge",
        "sm_judge_support",
        "sm_list_facts",
        "sm_list_graph_edges",
        "sm_list_imports",
        "sm_list_namespaces",
        "sm_list_sessions",
        "sm_parse_choice",
        "sm_parse_json",
        "sm_parse_json_value",
        "sm_parse_number",
        "sm_parse_string_list",
        "sm_query_claim_versions",
        "sm_query_entity_aliases",
        "sm_query_episodes",
        "sm_query_evidence_refs",
        "sm_query_relation_versions",
        "sm_reconcile",
        "sm_record_outcome",
        "sm_reembed_all",
        "sm_repair_json",
        "sm_replay_search_receipt",
        "sm_route_query",
        "sm_run_lifecycle",
        "sm_search",
        "sm_search_as_of",
        "sm_search_conversations",
        "sm_search_with_routing",
        "sm_search_witnessed",
        "sm_set_provenance",
        "sm_stats",
        "sm_strip_think_tags",
        "sm_supersede_fact",
        "sm_topology",
        "sm_update_fact",
        "sm_vacuum",
        "sm_verify_claim"
      ],
      "ingestion": "sm_add_fact",
      "retrieval": "sm_search_witnessed"
    },
    "receipt_schema_path": "/home/sikmindz/Coding/agent-memory-kits/shared/fixtures/schemas/beir-scifact-ranking-receipt.schema.json",
    "receipt_schema_sha256": "sha256:bede07b523e1ed896efebc2a445d1143b21a746b9081c94900e435e793ac354f",
    "runner_sha256": "sha256:b79987d76703f654f9e6b5343ade4d50603c5866a149a7738705225f90cd83e6",
    "runtime_binary": {
      "path": "/home/sikmindz/Coding/Libraries/semantic-memory-mcp/target/release/semantic-memory-mcp",
      "sha256": "sha256:0f55b21e28dc52f48a8db430ef972d8bb92452c31706bbf33f1ce86ada7f23cf"
    },
    "single_service": true,
    "stats": {
      "chunks": 0,
      "components": {
        "core": {
          "error": null,
          "health": "healthy"
        },
        "graph": {
          "error": null,
          "health": "healthy"
        }
      },
      "db_size_bytes": 53407744,
      "db_size_mb": 50.93,
      "documents": 0,
      "embedding_dimensions": 384,
      "embedding_model": "all-minilm:latest",
      "facts": 5183,
      "graph_edges": 0,
      "messages": 0,
      "ok": true,
      "sessions": 0
    },
    "store_path": "/home/sikmindz/Coding/agent-memory-kits/.bench-data/beir-scifact-ranking/store-full-all-minilm-latest-700"
  },
  "ingestion": {
    "active_pass_elapsed_seconds": 0.00200790200051415,
    "checkpoint_path": "/home/sikmindz/Coding/agent-memory-kits/.bench-data/beir-scifact-ranking/ingestion-full-all-minilm-latest-700.jsonl",
    "checkpoint_sha256": "sha256:7b84352394f0d0dfcbcbf54eeaf1637e11accd5111785af8864266be178975e0",
    "checkpoint_timing": {
      "created_at": "2026-07-11T13:10:00+00:00",
      "initial_write_span_seconds": 628.0248136520386,
      "last_admission_at": "2026-07-11T13:20:28.024814+00:00",
      "source": "filesystem birth-to-last-modification timestamps"
    },
    "checkpointed_docs": 5183,
    "failures": [],
    "requested_docs": 5183
  },
  "modes": {
    "fts_only": {
      "reason": "not selected for this mode-separated run",
      "status": "not_selected"
    },
    "hybrid": {
      "metrics": {
        "failures": 0,
        "latency_ms": {
          "mean": 62.751155069969776,
          "p50": 62.715766999644984,
          "p95": 70.87061039997025
        },
        "map_at_10": 0.6128994708994708,
        "mrr_at_10": 0.6236111111111111,
        "ndcg_at_10": 0.6618425649100079,
        "qrels_count": 339,
        "query_count": 300,
        "recall_at_k": {
          "1": 0.5102222222222222,
          "10": 0.7983333333333333,
          "5": 0.7489444444444444
        },
        "success_at_k": {
          "1": 0.53,
          "10": 0.81,
          "5": 0.77
        }
      },
      "status": "measured"
    },
    "vector_only": {
      "reason": "not selected for this mode-separated run",
      "status": "not_selected"
    }
  },
  "repositories": {
    "agent_memory_kits": {
      "commit": "28efd9f230d0a9cc05a0e78ddf7cde96e6170b00",
      "dirty": true,
      "path": "/home/sikmindz/Coding/agent-memory-kits"
    },
    "semantic_memory": {
      "commit": "8165bb3796c3dd77079ef72ce31e0c79b5e50daa",
      "dirty": true,
      "path": "/home/sikmindz/Coding/Libraries/semantic-memory"
    },
    "semantic_memory_mcp": {
      "commit": "fa529b86ef4ac169eca97f511cc626fd058dd509",
      "dirty": true,
      "path": "/home/sikmindz/Coding/Libraries/semantic-memory-mcp"
    }
  },
  "run_kind": "full",
  "schema": "BeirScifactRankingBenchmarkV1",
  "status": "measured",
  "timestamp": "2026-07-11T13:47:59.588673+00:00"
}
